name,description,Ammonia,Apple,Apricot,Berry,Blue Cheese,Blueberry,Cheese,Chemical,Chestnut,Citrus,Coffee,Diesel,Earthy,Flowery,Grape,Grapefruit,Honey,Lavender,Lemon,Lime,Mango,Mint,Nutty,Orange,Pepper,Pine,Pineapple,Plum,Pungent,Sage,Skunk,Spicy/Herbal,Strawberry,Sweet,Tar,Tea,Tobacco,Tree Fruit,Tropical,Vanilla,Woody,Aroused,Creative,Energetic,Euphoric,Focused,Giggly,Happy,Hungry,Relaxed,Sleepy,Talkative,Tingly,Uplifted,Hybrid,Indica,Sativa
Purple Haze,"Purple Haze is a cultivar with uncertain origins. Its name first appeared around the time that purple LSD caps -- also called Purple Haze -- were sold in the 1960s and 70s. The potent flower earned the name thanks to its vividly violet buds and trichome density. 

According to Sam the Skunkman, the strain originated in Colombia, a phenotype of the standardized Haze cultivar he bred during that time frame. 

Purple Haze is one of several Original Haze phenotypes to descend from stabilized Columbian seeds that were cultivated by the Haze Brothers, according to Royal Queen Seeds. Purple Haze became the most popular of these phenotypes, leading to several hybrids and variations over the following decades. 


",0,0,0,1,0,0,0,0,0,0,0,0,1,0,0,0,0,0,0,0,0,0,0,0,0,0,0,0,0,0,0,0,0,1,0,0,0,0,0,0,0,1,0,0,1,0,0,0,0,0,0,0,0,1,1,0,0
Purple Lotus,"Purple Lotus is a rare and sought-after strain created by breeder Master Thai. A serendipitous discovery, Purple Lotus is a descendent of Turkey and Purple Mendo that leans into its pine aroma and skunky flavor. This highly potent Indica-dominant strain reportedly starts by inducing euphoria before settling into a deeply relaxed state.",0,0,0,0,0,0,0,0,0,0,0,0,1,1,0,0,0,0,0,0,0,0,0,0,0,0,0,0,0,0,0,0,0,0,0,0,0,0,0,0,1,0,0,1,1,0,0,1,0,0,0,0,0,0,1,0,0
Purple Punch,"A cross between Granddaddy Purple and Larry OG, the original Purple Punch strain was claimed to be bred by the Hawaiian breeders at Supernova Gardens. Regardless of its origins, Purple Punch has made its way into the hands of the world’s most renowned growers, such as the Los Angeles-based Jungle Boys. With an aroma of blueberries and grape soda, this indica-leaning strain might sound sweet, but it also tends to pack a potent punch, with some strains reportedly carrying THC levels that range between 20% to 25%.   

",0,0,0,1,0,0,0,0,0,0,0,0,0,0,0,0,0,0,0,0,0,0,0,0,0,0,0,0,1,0,0,0,0,1,0,0,0,0,0,0,0,0,0,0,1,0,0,1,0,1,0,0,0,0,1,0,0
Purple Tangie,"Like the tangerines that the name evokes, Purple Tangie is bursting with citrus freshness and floral undertones. Of mysterious origins, Purple Tangie won first place in the category of Best Medical Sativa Concentrate in the 2016 High Times Cannabis Cup. Some users note feeling productive and mentally uncluttered after smoking the THC-high (22%) Purple Tangie.",0,0,0,1,0,0,0,0,0,0,0,0,1,1,0,0,0,0,0,0,0,0,0,0,0,0,0,0,0,0,0,0,0,0,0,0,0,0,0,0,0,0,0,1,1,1,0,0,0,0,0,0,0,0,1,0,0
Purple Trainwreck,"Purple Trainwreck (also called Purple Wreck) is a cross of Mendocino Purps, also known as Mendo Purps, and Trainwreck bred by the Humboldt Seed Organization in Northern California. 

Purple Trainwreck tends to produce cerebral, psychotropic effects that taper off into a heavily relaxing high. Giving off a spicy citrus scent, this popular purple strain has a flavor profile described as a fusion of lemon, pine, and lavender.
",0,0,0,0,0,0,0,0,0,1,0,0,0,0,0,0,0,0,0,0,0,0,0,0,0,1,0,0,0,0,0,0,0,0,0,0,0,0,0,0,1,0,0,0,1,0,1,0,0,0,1,0,0,0,1,0,0
Purple Urkle,"Not much is known about Purple Urkle’s origin story, except that it first appeared in the 1980s. Some online sources claim that the cultivar’s heritage can be traced back to Mendocino Purps, a well-known cannabis strain produced in Northern California’s Emerald Triangle. Others speculate that Purple Urkle could be a phenotype of either Mendocino Purps or Granddaddy Purple. Regardless of its origin, Purple Urkle’s resplendent purple coloring, due to a healthy amount of anthocyanins, undoubtedly contributed to its name.

Lab tests indicate larger percentages of the terpene myrcene contribute to Purple Urkle’s earthy, musky aromas, while the presence of alpha-pinene counteract the terpene’s more sedative effects. Users compliment Purple Urkle for its berry flavors and its impressive THC content, which clocks in between 17-22%, depending on grow conditions. 


",0,0,0,1,0,0,0,0,0,0,0,0,1,0,1,0,0,0,0,0,0,0,0,0,0,0,0,0,0,0,0,0,0,0,0,0,0,0,0,0,0,0,0,0,1,0,0,1,0,1,0,0,0,0,1,0,0
Rainbow,"Rainbow is a combination of Dancehall with Blueberry created by Spain-based Lifetime Seeds. The strain is so-named for its brilliant combination of orange hairs; purple, green, and blue coloring; and yellow-green leaves. Rainbow emits a strong citrus smell layered with an incense-like spice, while the smoke tastes like a plate of spiced fruit.",0,0,0,0,0,0,0,0,0,0,0,0,0,1,0,0,0,0,0,0,0,1,0,0,0,0,0,0,0,0,0,0,0,1,0,0,0,0,0,0,0,0,0,0,1,0,0,0,1,1,0,0,0,0,1,0,0
Rainbow Sherbet,"Rainbow Sherbet (also spelled Sherbert) is a combination of Champagne and Blackberry bred by the team at Apothecary Genetics. The cultivar is named for its notes of berries and herbs as well as the buzzy, bubbly mood it reportedly provides on consumption. Online sources describe the strain as relatively potent with THC levels of 20-22%.",0,0,0,0,0,0,0,0,0,0,0,0,0,1,0,0,0,0,0,0,0,1,0,0,0,0,0,0,0,0,0,0,0,1,0,0,0,0,0,0,0,0,1,0,0,1,0,0,0,1,0,0,0,0,1,0,0
Red Congolese,"This 100% pure sativa strain won 3rd place in 2013 for overall best at the High Times’ Cannabis Cup. Red Congolese offers moderate THC levels (averaging 18% to 20%) and can deliver tingling, elated sensations. 

Though the name evokes African origins, Red Congolese originated in California from a blend of Mexican and Afghan roots. Perhaps these global origins lend Red Congolese its decidedly earthy flavor profile. Red Congolese is sometimes mistaken for Congolese Red by SnowHigh Seeds, but the two strains are distinct.",0,0,0,0,0,0,0,0,0,1,0,0,0,0,0,1,0,0,0,0,0,0,0,0,0,0,0,0,0,0,0,1,0,0,0,0,0,0,0,0,0,0,0,1,1,1,0,0,0,0,0,0,0,0,1,0,0
Red Diesel,"Red Diesel is a creation of the Amsterdam-based seed bank Barney’s Farm, which crossed NYC Diesel with California Orange to form this cerebrally stimulating sativa-leaning bud. 

Pulling from its ancestors, Red Diesel carries an aroma of sweet orange and diesel fuel, translating into a flavor that the breeder described as earthy, citrusy, and all-around dank. One sample of Red Diesel analyzed by the cannabis testing lab MCR Labs had THC levels of 19.49%, along with a notable presence of myrcene, limonene, and other terpenes. 

",0,0,0,0,0,0,0,0,0,0,1,1,0,0,0,0,0,0,0,0,0,0,0,0,0,0,0,0,0,0,0,0,0,1,0,0,0,0,0,0,0,0,0,1,1,1,0,0,0,0,0,0,0,0,1,0,0
Remedy,"Remedy is a high-CBD strain reportedly created by CBD Crew, a collaboration between Mr. Nice and Resin Seeds, the creator of the famed Cannatonic strain. The breeders developed Remedy by crossing a Cannatonic female with an Afghan and Skunk male from Mr. Nice. The strain, originally called Z7, has a 28:1 CBD-to-THC ratio, according to online sources testing at 14% CBD and 0.5% THC. It has a woody, sweet flavor profile.

",0,0,0,0,0,0,0,0,0,0,0,0,1,0,0,0,1,0,0,0,0,1,0,0,0,0,0,0,0,0,0,0,0,0,0,0,0,0,0,0,0,0,0,0,1,0,0,0,0,1,1,0,0,0,1,0,0
Romulan,"Romulan, a cultivar named for the famous “Star Trek” species, is a cultivar with mysterious origins. Breeder boards speculate that the flower was created by a breeder named Romulan Joe (formerly Mendocino Joe), a Vietnam veteran who was a founder of the Trinity grow scene in Northern California. Romulan Joe allegedly gave a clone of Romulan to Federation Seeds in British Columbia, who used White Rhino to crossbreed and stabilize Romulan at a purported 97% identical to the original strains.

Romulan is said to be a descendent of Afghani landrace strains, often included in a group of cultivars in the 1980s called Blue Indicas. Breeders can get their hands seeds on this purple-colored flower, thanks to its anthocyanin content, from Federation Seeds and Next Generation Seeds. 

Lab tests report Romulan’s THC content anywhere between 18-24%, which makes this cultivar a good choice for users seeking a more potent experience. Romulan won third prize for Best Non-Solvent Hash in the 2017 High Times Medical Cannabis Cup in Canada.",0,0,0,0,0,0,0,0,0,0,0,0,1,1,0,0,0,0,0,0,0,0,0,0,0,0,0,0,0,0,0,0,0,0,0,0,0,0,0,0,1,0,0,0,1,0,0,0,0,1,1,0,0,0,1,0,0
Rose Gold,"Breeder Archive Seeds claims it created Rose Gold, which is a cross of Pineapple Express and MoonBow #75, specifically for use in hash production. According to the breeder, Rose Gold contains an astounding 28% THC and has a fruity, tropical, earthy flavor profile.",0,0,0,0,0,0,0,0,0,0,0,1,1,0,0,0,0,0,0,0,0,0,0,0,0,0,0,0,0,0,0,0,0,0,0,0,0,0,1,0,0,0,0,0,1,0,0,0,0,1,1,0,0,0,1,0,0
Runtz,"Coming out of LA, this strain's candy-like smelling sweetness and colorful nugs lead to its naming. A mix of Zkittlez and Gelato #33, this strain has a smooth flavor that mostly matches the smell, with additional tropical and earthy hints. 

With a few different phenotypes, this hybrid strain can lean to either a more dominant sativa or indica. These nugs produce thick resin layers which make it extremely potent in any form. Perhaps that is why this strain is so elusive. Make sure to get your hands on this if you can; it'll have you feeling like a kid in a candy store.",0,0,0,0,0,0,0,0,0,0,0,0,0,0,0,0,0,0,0,0,0,0,0,1,0,0,1,0,0,0,0,0,0,1,0,0,0,0,0,0,0,0,1,1,0,0,0,0,0,1,0,0,0,0,1,0,0
San Fernando Valley OG,,0,0,0,0,0,0,1,0,0,1,0,0,0,0,0,0,0,0,0,0,0,0,0,0,0,0,0,0,0,0,0,0,0,0,0,0,0,0,0,0,1,0,0,1,1,0,0,0,0,1,0,0,0,0,1,0,0
Sensi Star,"Sensi Star is a mid-’90s creation from Paradise Seeds in Amsterdam. Its exact lineage remains a mystery, though Paradise has revealed that the strain’s genetics lean heavily toward its Afghan heritage. This strain is the winner of more than a dozen awards, (including first place Bio at Highlife Cannabis Cup in 1999, third Place at the 2005 High Times Cannabis Cup, and first Hydro at High Life Cannabis Cup in 2010. 

Sensi Star grows short and dense with thick, dark-green leaves in a flowering time of 56 to 63 days. Its stonelike buds are heavily frosted with well-pronounced trichomes, delivering a metallic, minty-sweet flavor. Though an outdoor grow with plenty of sun will generally get the highest yields from Sensi Star, the strain’s compact size makes it great for indoor growing as well. It responds particularly well to Sea of Green (SOG) and Screen of Green (SCROG) systems, as its side branches can also be high-yielding. Paradise Seeds carries both regular and feminized Sensi Star seeds. 
",0,0,0,0,0,0,0,0,0,0,0,1,0,0,0,0,0,0,0,0,0,0,0,0,0,1,0,0,0,0,0,0,0,1,0,0,0,0,0,0,0,0,0,1,0,0,0,0,0,1,1,0,0,0,1,0,0
SFV OG,"SFV OG - or San Fernando Valley OG - began as a phenotype of OG Kush. A grower named Swerve at Cali Connection Farms in Southern California’s San Fernando Valley bred it with an Afghani  from Homegrown Fantaseeds. The resulting strain takes its initials from its parent strain, as well as the abbreviated location of its seed bank. 

Breeders created the strain after selecting OG Kush for its earthy, lemony smell and sedating properties, which are the result of high levels of myrcene, limonene and caryophyllene.

The strain took 3rd place in the Indica category at the High Times Cannabis Cup in Amsterdam in 2012, and 1st place at the Denver Cannabis Cup that same year.",0,0,0,0,0,0,0,0,0,0,0,0,0,1,0,0,0,0,0,0,0,0,0,0,0,1,0,0,0,1,0,0,0,0,0,0,0,0,0,0,0,0,0,0,1,0,1,0,0,1,0,0,0,0,1,0,0
Shark Shock,"Shark Shock is a combination of legendary parents Black Widow (a backcrossed White Widow) and Skunk #1 created by breeder Mr. Nice Seedbank. Both parent strains originate from landrace cultivars sourced worldwide. Shark Shock tastes of sweet and sour fruit with a matching terpene profile. Amsterdam Seed Center reports cannabinoid levels of more than 20% THC for this strain.
",0,0,0,0,0,0,0,0,0,0,0,0,0,1,0,0,0,0,0,0,0,0,0,0,0,0,0,0,0,0,1,0,0,0,0,0,0,0,0,0,1,0,0,0,1,0,0,0,0,1,1,0,0,0,1,0,0
Sherbet,"Also known as Sherbert or Sunset Sherbert, this strain is an Indica-leaning hybrid that crosses a female GSC (Girl Scout Cookies) with a Pink Panties male. 

Sherbert was accidentally produced in San Francisco Bay when Mr. Sherbinski introduced a male Pink Panties into a room of GSC he was growing at his grandmother's house.

Sherbet was the 3rd-place winner at the 2017 Amsterdam Cannabis Cup for best Coffeeshop Flower.",0,0,0,1,0,0,0,0,0,0,0,0,0,1,0,0,0,0,0,0,0,0,0,0,0,0,0,0,0,0,0,0,0,1,0,0,0,0,0,0,0,0,0,0,1,0,1,0,0,1,0,0,0,0,0,1,0
Silver Haze,"A classic commercial “Sativa” strain, Silver Haze originates with breeders Scott Blakey (AKA Shantibaba), Howard Marks (AKA Mr. Nice), and Neville Schoenmaker, who retooled their Super Silver Haze strain — a hybrid of Skunk x Northern Lights x Haze — and called it Silver Haze when they left Greenhouse Seed Company. Today’s Silver Haze is a hybrid of Northern Lights #5 x Haze, bred by Sensi Seeds in Amsterdam, and sold as both feminized and non-feminized seeds. 

Silver Haze won the bronze for Best Sativa in the 2005 High Times Cannabis Cup while its closest relative, Super Silver Haze, has won countless awards. With THC levels averaging at 20-24%, Silver Haze is considered one of the most potent “Sativa” strains on the market. Its effects are frequently reported as heavily cerebral, uplifting, and energizing.
",0,1,0,0,1,0,0,0,0,0,0,0,0,0,0,0,0,0,0,0,0,0,0,0,0,0,0,0,0,0,1,0,0,0,0,0,0,0,0,0,0,0,1,0,0,1,0,1,0,0,0,0,0,0,0,0,1
Skywalker OG,"This strain, which reportedly originated in California, is a cross of Skywalker from Dutch Passion Seeds and OG Kush from JoshD Farms. 

",0,0,0,0,0,1,0,0,0,0,0,1,1,0,0,0,0,0,0,0,0,0,0,0,0,0,0,0,0,0,0,0,0,0,0,0,0,0,0,0,0,0,0,0,0,0,0,1,0,1,1,0,0,0,1,0,0
Slimer,"Formerly known as Golden Ticket, Slimer (also called Slimer OG) is a sativa-dominant hybrid from MzJill Genetics in California cultivated from a cut of Chernobyl, itself a cross between Jack the Ripper and a phenotype of Trainwreck. 

Offering aroma and taste of citrus candy and fuel, Slimer grows resinous flowers and a gold color that turns burgundy. It’s said to produce a cerebral and euphoric high.",0,0,0,0,0,0,0,0,0,1,0,0,1,1,0,0,0,0,0,0,0,0,0,0,0,0,0,0,0,0,0,0,0,0,0,0,0,0,0,0,0,0,1,0,0,0,0,1,0,1,0,0,0,0,1,0,0
Slurricane,"Bred by the team at In House Genetics, Slurricane is a cross of Dosidos and Purple Punch. The strain’s indica-dominant flowers feature a sugary coating, thanks go the OG and Grand Daddy Purple genetics in their lineage, both known as strains with high levels of trichomes.",0,0,0,1,0,0,0,0,0,0,0,0,0,1,0,0,0,0,0,0,0,0,0,0,0,0,0,0,0,0,0,0,0,1,0,0,0,0,0,0,0,0,0,0,1,0,0,0,0,1,1,0,0,0,1,0,0
Sour Amnesia,"Sour Amnesia was created by Amsterdam-based HortiLab Seeds as a combination of Sour Diesel and Amnesia. Per the breeders, Sour Amnesia averages between 15-22% THC and reeks of sour earth and diesel with matching, floral-tinged flavors. Consumers report more cerebral effects, with a euphoric afterglow that lasts for hours after consumption.",0,0,0,0,0,0,1,1,0,0,0,0,0,1,0,0,0,0,0,0,0,0,0,0,0,0,0,0,0,0,0,0,0,0,0,0,0,0,0,0,0,0,1,0,0,1,0,0,0,1,0,0,0,0,1,0,0
Sour Apple,"A cross between an original Sour Diesel clone and a Cinderella 99 male, Sour Apple is a hybrid strain originally bred by Top Shelf Seeds. Sour Apple is usually distinguishable by its pronounced aromatic fusion of caramelized apples and diesel fuel. 

While the original cut of Sour Apple was reportedly only available as a clone, other purported variations have popped up in certain seed bank selections. Even Los Angeles-based cannabis farmers Jungle Boys have a Sour Apple cultivar in their arsenal. Boasting a sweet and skunky flavor profile, Sour Apple has energetic and euphoric effects typical of a sativa, despite some sources claiming that Sour Apple is an indica dominant strain. 

",0,1,0,0,0,0,0,0,0,0,0,0,1,0,0,0,0,0,0,0,0,0,0,0,0,0,0,0,0,0,0,0,0,1,0,0,0,0,0,0,0,0,0,1,1,0,0,0,0,0,1,0,0,0,1,0,0
Sour Banana Sherbet,"Crockett Family Farms cut its own Sour Diesel with Banana Sherbet to create Sour Banana Sherbet. The strain has 18-24% THC content and a fruity petroleum flavor, according to seed bank Seeds Here Now. 

",0,0,0,1,0,0,0,0,0,0,0,1,0,0,0,0,0,0,0,0,0,0,0,0,0,0,0,0,0,0,0,1,0,0,0,0,0,0,0,0,0,0,1,0,0,0,0,0,0,1,1,0,0,0,1,0,0
Sour Diesel,"Also known as Sour D and East Coast Sour Diesel (or ECSD,) Sour Diesel is a prolific strain with somewhat tumultuous origins. 

According to online sources, Sour Diesel gained prominence in New York in the mid-90s when breeder AJ (short for A**hole Joe,) accidentally pollinated a Chemdog 91 female with pollen from a Super Skunk he acquired during a trip to Amsterdam. The end result, Sour Diesel,  was reportedly named for the way it soured business relationships as it spread through New York’s underground cannabis market, causing rifts as it changed hands among growers. 

",0,0,0,0,0,0,0,0,0,1,0,1,1,0,0,0,0,0,0,0,0,0,0,0,0,0,0,0,0,0,0,0,0,0,0,0,0,0,0,0,0,0,0,0,0,0,0,1,0,1,0,0,0,1,1,0,0
Sour Kush,"Sour Kush is a DNA Genetics creation, bred from a Sour Diesel female and OG Kush male. Pungent with both fuel and skunky citrus aromas, Sour Kush features a heavy-hitting potency that’s easily explained by its parentage and a hefty percentage of limonene.

",0,0,0,0,0,0,0,0,0,0,0,0,1,0,0,0,0,0,1,0,0,0,0,0,1,0,0,0,0,0,0,0,0,0,0,0,0,0,0,0,0,0,0,0,1,0,1,0,0,0,0,0,0,1,1,0,0
Sour Mango,"A reported cross between the classic sativa-leaning Sour Diesel and Mango Haze, which was bred by Mr. Nice Seeds, the original breeders of the seemingly rare Sour Mango strain remains a mystery. But as its name indicates, this well-balanced hybrid strain boasts a tropical aroma of rotten mangoes and diesel fuel.    

",0,0,0,0,0,0,0,0,0,0,0,1,0,0,0,0,0,0,0,1,0,0,0,0,0,0,0,0,0,0,0,0,0,0,0,0,0,0,1,0,0,0,1,0,0,1,0,0,0,0,0,1,0,0,1,0,0
Sour Tangie,"As of several hybrids descended from Tangie, Sour Tangie is a flavorful strain with a striking terpene profile that emulates both of its aromatic parents. 

Amsterdam-based DNA Genetics pollinated a Sour Diesel female with pollen from a Tangie male to produce this pungent bud with a lingering sweet-and-sour, fruit-and-diesel taste.


",0,0,0,0,0,0,0,0,0,0,0,0,1,1,0,0,0,0,0,0,0,0,0,0,0,1,0,0,0,0,0,0,0,0,0,0,0,0,0,0,0,0,0,1,0,1,0,0,0,0,0,0,0,1,1,0,0
Sour Tsunami,"Sour Tsunami is a Sativa-dominant hybrid that was first bred by Lawrence Ringo of the Southern Humboldt Seed Collective. After crossing an NYC Diesel with the Sour Diesel strain and back-crossing it with a Sour Diesel clone, Ringo then crossed the resulting genetics, which he named Double Diesel, to a West Coast Sativa-dominant strain called Ferrari. 

In 2010, Ringo then crossed those genes back with Sour Diesel, and the CBD-rich strain known as Sour Tsunami was officially bred. When grown from seeds, the strain is known for producing several phenotypes, of which about 25 percent will produce CBD-rich flowers. 

The strain won second place in 2018 for best CBD flower at Colorado’s famed Rooster Cup.
",0,0,0,0,0,1,0,0,0,0,0,0,0,0,0,0,0,0,0,1,0,0,0,0,0,0,0,0,0,0,0,0,0,0,0,0,0,0,1,0,0,0,0,1,0,1,0,0,0,1,0,0,0,0,1,0,0
Space Monkey,"Space Monkey is an indica dominant hybrid bred by Bodhi Seeds. A cross between Gorilla Glue #4 and Wookie #15, it has notes of lavender, citrus, grape, and hops. Coated in frosty trichomes with fine orange hairs, the nugs give the appearance of having been dusted by fresh snowfall. This strain is something special. 

This strain is reported to provide a well-balanced high that is both stimulating as well as relaxing. The effect is a nice body buzz without the couch lock. THC levels are moderate at 15-20%.",0,0,0,0,0,0,0,0,0,1,0,1,0,1,0,0,0,0,0,0,0,0,0,0,0,0,0,0,0,0,0,0,0,0,0,0,0,0,0,0,0,0,0,1,1,0,0,0,0,1,0,0,0,0,1,0,0
Stardawg,"StarDawg, or Star Dawg, is a cross between a female Chemdawg 4 and a male Tres Dawg. Propagated by JJ Edwards of Top Dawg Seeds in 2011, Star Dawg is said to express a couple of phenotypes, one of which is considered Indica-dominant and the other considered to be Sativa-dominant. 

While the most famous StarDawg pheno, the Guava cut, won first place in the Best Sativa category at the 2012 Denver High Times Medical Cannabis Cup, the strain has been updated and reissued four times since 2011. 

The newest variations from StarDawg’s gene pool are referred to as the Illuminati, Corey Haim, and Kate Upton cuts. Despite sharing the same gene pool, each cut provides a slightly different flavor profile, smell, effect, plant structure, and flowering time. Of the varied cuts, Kate Upton is the most purple, Guava is the sweetest and produces the heaviest yields, while the Corey Haim and Illuminati cuts are claimed to be the most potent.

Dependent on the cut of StarDawg cultivated, the strain will either produce a short, compact, fast-flowering, Indica-dominant plant; or a fast-stretching, rapidly blossoming, Sativa-dominant plant. Indoors, the Sativa-leaning cut of Stardawg will finish flowering in roughly 63-73 days, while outdoor cultivators will need to wait until early October in the Northern Hemisphere, or early April in the Southern Hemisphere before they can harvest. The Indica-dominant cut of StarDawg, grown either indoors or outdoors, will take roughly 65 days to fully mature after entering the flowering period.

",0,0,0,0,0,0,0,1,0,0,0,1,0,0,0,0,0,0,0,0,0,0,0,0,0,0,0,0,0,0,1,0,0,0,0,0,0,0,0,0,0,0,1,1,0,0,0,1,0,0,0,0,0,0,1,0,0
StarKiller OG,"Starkiller -- sometimes called Star Killer or Starkiller OG -- was created in 2012 by Alabama-born Scott “Moonshine” Reach, founder of Colorado seed bank Rare Dankness. To create the strain, Reach pollinated a Skywalker OG clone from Denver’s Hartland Farmacy with pollen from his own Rare Dankness #2 male, which is a hybrid of Rugburn OG back-crossed with its Ghost OG mother. 

Starkiller’s won more than 50 awards across the globe, including 3rd Medical Hybrid and 2nd Colorado Hybrid at High Times’ Cannabis Cup in 2016. Reach said on average, Starkiller tests at more than 23% THC, and is frequently reported by combat veterans to quell anxiety and post-traumatic stress disorder (PTSD) symptoms. 


",0,0,0,0,0,0,0,0,0,0,0,0,0,0,0,0,1,0,1,0,0,0,0,0,0,0,0,0,0,0,0,0,0,1,0,0,0,0,0,0,0,0,0,0,0,0,0,0,0,1,1,0,0,1,1,0,0
Strawberry,"Strawberry is an enigma of a cultivar with unknown genetics and an unknown breeder, though most online sources agree this strain was born in the Netherlands. Those who have sampled Strawberry claim it tastes like sweet, fresh berries with an earthy finish and smells of pungent fruit.
",0,0,0,0,0,0,0,0,0,0,0,0,1,1,0,0,0,0,0,0,0,0,0,0,0,0,0,0,0,0,0,0,1,0,0,0,0,0,0,0,0,1,1,1,0,0,0,0,0,0,0,0,0,0,0,0,1
Strawberry Banana,"Bred in Amsterdam by Reserva Privada -- a subdivision of DNA Genetics -- Strawberry Banana’s (also referred to as Strawnana) mother is a female Banana Kush from Crockett Family Farms crossed with a male Bubblegum selected from a pack of seeds originally bred by Serious Seeds. 

The end result is a frosty, resinous bud that’s notably easy to grow in virtually any environment, both indoors and outdoors. 

The strain has won several awards, including 1st Sativa Flower at the 2015 High Times Cannabis Cup, and 1st Judges Choice at Cannabis Cup Brazil in 2016. 

",0,0,0,0,0,0,0,0,0,0,0,0,1,0,0,0,0,0,0,0,0,0,0,0,0,0,0,0,0,0,0,0,1,1,0,0,0,0,0,0,0,1,0,0,1,1,0,0,0,0,0,0,0,0,1,0,0
Strawberry Cheesecake,"Strawberry Cheesecake, also called Strawberry Cake, is a cross of Chronic, White Widow and Cheese created by the breeder team at Heavyweight Seeds. According to the breeders, Strawberry Cheesecake tastes sweet, fruity, and earthy with matching aromas. Lab reports indicate a potency of 22% THC and 1.3% CBD. 
",0,0,0,0,1,0,1,0,0,0,0,0,1,0,0,0,0,0,0,0,0,0,0,0,0,0,0,0,0,0,0,0,0,0,0,0,0,0,0,0,0,0,0,1,0,1,0,0,0,0,0,1,0,0,0,1,0
Strawberry Diesel,"According to seed bank Holy Smoke Seeds, Strawberry Diesel is a cross of award-winning NYC Diesel and Strawberry Cough that results in a balanced hybrid with lots of trichomes and a reported moderate THC level. The taste is said to be sweet and fruity with diesel while it smells fruity and skunky.  ",0,0,0,0,0,0,0,1,0,0,0,1,0,0,0,0,0,0,0,0,0,0,0,0,0,0,0,0,0,0,0,0,0,1,0,0,0,0,0,0,0,0,0,0,1,0,0,1,0,1,0,0,0,0,1,0,0
Strawberry Fields,"Strawberry Fields is a popular name among breeders, as multiple cannabis connoisseurs have created a cultivar in homage of the Beatles’ hit. 

STRAWBERRY FIELDS BY SAGAMARTHA SEEDS
Strawberry Fields is a backcross of Strawberry Cough and an unknown Indica strain, first bred by the team at Sagarmatha Seeds. It tastes like fresh berries and smells similar with woodsy undertones, according to reviews online. 

STRAWBERRY FIELDS OF UNKNOWN ORIGIN
Another version of Strawberry Fields comes from mysterious origins, thought to have first appeared in Vermont, according to sources online. According to one website, Strawberry Fields is so-called because the breeder grew the crop among his or her strawberry patch. True to its name, it has a fresh strawberry flavor profile. 

",0,0,0,0,0,0,0,0,0,0,0,0,1,1,0,0,0,0,0,0,0,0,0,0,0,0,0,0,0,0,0,0,1,0,0,0,0,0,0,0,0,0,0,0,1,0,0,0,1,1,0,0,0,0,0,1,0
Strawberry Kush,Strawberry Kush is most often found as a clone-only cross between Strawberry Cough and OG Kush. ,0,0,0,0,0,0,0,0,0,0,0,0,0,0,0,0,0,0,0,0,0,0,0,0,1,0,0,0,0,0,0,1,1,0,0,0,0,0,0,0,0,0,0,0,0,1,0,0,0,1,0,0,0,1,1,0,0
